{
  "specversion": "1.0",
  "id": "0190f2de-7f56-7f52-a4f0-d4a20d7d2e01",
  "source": "urn:estimulo:service:learning-delivery",
  "type": "org.estimulo.learning.activity.completed",
  "subject": "urn:estimulo:activity-instance:11111111-1111-4111-8111-111111111111",
  "time": "2026-07-08T14:30:00Z",
  "datacontenttype": "application/json",
  "dataschema": "https://schemas.estimulo.org/events/learning/activity-completed/1.0.0.json",
  "tenantid": "22222222-2222-4222-8222-222222222222",
  "correlationid": "33333333-3333-4333-8333-333333333333",
  "causationid": "44444444-4444-4444-8444-444444444444",
  "traceparent": "00-4bf92f3577b34da6a3ce929d0e0e4736-00f067aa0ba902b7-01",
  "partitionkey": "journey-instance:55555555-5555-4555-8555-555555555555",
  "aggregateid": "11111111-1111-4111-8111-111111111111",
  "aggregateversion": 7,
  "privacyclass": "pseudonymous",
  "producer": "learning_delivery",
  "clienteventid": null,
  "correctionof": null,
  "data": {
    "activity_instance_id": "11111111-1111-4111-8111-111111111111",
    "activity_version_id": "66666666-6666-4666-8666-666666666666",
    "journey_instance_id": "55555555-5555-4555-8555-555555555555",
    "completion_policy_version": "activity-completion-v1",
    "completed_at": "2026-07-08T14:30:00Z",
    "evidence_refs": [
      "77777777-7777-4777-8777-777777777777"
    ],
    "active_duration_seconds": 724,
    "actor": {
      "entrepreneur_id": "88888888-8888-4888-8888-888888888888",
      "business_id": "99999999-9999-4999-8999-999999999999"
    },
    "context": {
      "path_assignment_id": "aaaaaaaa-aaaa-4aaa-8aaa-aaaaaaaaaaaa",
      "path_step_id": "bbbbbbbb-bbbb-4bbb-8bbb-bbbbbbbbbbbb",
      "session_id": "cccccccc-cccc-4ccc-8ccc-cccccccccccc"
    },
    "evidence": {
      "kind": "server_transactional",
      "verification_status": "verified"
    }
  }
}